[
  {
    "name": "cloud-nat-options-all-a",
    "label": "cloud-nat-options-all-a",
    "routing_mode": "GLOBAL",
    "cloud_nat": {
      "subnetworks_to_nat": "ALL_PRIMARY_SUBNETWORKS_ALL_SECONDARY_SUBNETWORKS",
      "log_config": "ALL",
      "min_ports_per_vm": 128,
      "udp_idle_timeout": 100,
      "endpoint_independent_mapping": "ENABLED"
    },
    "subnetworks": [
      {
        "region": "US-WEST1",
        "ip_cidr_range": "172.16.32.0/24"
      },
      {
        "region": "US-WEST1",
        "ip_cidr_range": "172.16.33.0/24"
      },
      {
        "region": "US-EAST4",
        "ip_cidr_range": "172.16.34.0/24"
      }
    ]
  },
  {
    "name": "cloud-nat-options-selected-a",
    "label": "cloud-nat-options-selected-a",
    "routing_mode": "GLOBAL",
    "cloud_nat": {
      "subnetworks_to_nat": "SELECTED_PRIMARY_SUBNETWORKS_SELECTED_SECONDARY_SUBNETWORKS",
      "nat_groups": [
        {
          "nat_group_id": "alpha",
          "log_config": "ALL",
          "endpoint_independent_mapping": "DISABLED"
        },
        {
          "nat_group_id": "bravo",
          "log_config": "ERRORS_ONLY",
          "endpoint_independent_mapping": "ENABLED"
        },
        {
          "nat_group_id": "charlie",
          "log_config": "TRANSLATIONS_ONLY"
        },
        {
          "nat_group_id": "delta",
          "log_config": "DISABLED"
        }
      ]
    },
    "subnetworks": [
      {
        "region": "US-WEST1",
        "ip_cidr_range": "172.16.32.0/24",
        "cloud_nat": {
          "nat_group_id": "alpha",
          "subnetworks_to_nat": "PRIMARY_SUBNETWORK"
        }
      },
      {
        "region": "US-WEST1",
        "ip_cidr_range": "172.16.33.0/24",
        "cloud_nat": {
          "nat_group_id": "bravo",
          "subnetworks_to_nat": "PRIMARY_SUBNETWORK"
        }
      },
      {
        "region": "US-EAST4",
        "ip_cidr_range": "172.16.34.0/24",
        "cloud_nat": {
          "nat_group_id": "charlie",
          "subnetworks_to_nat": "PRIMARY_SUBNETWORK_SELECTED_SECONDARY_SUBNETWORKS"
        },
        "secondary_subnetworks": [
          {
            "ip_cidr_range": "172.16.35.0/24",
            "nat_group_id": "delta"
          }
        ]
      }
    ]
  },
  {
    "name": "cloud-nat-options-all-b",
    "project_id": "rteller-demo-hst-e265-aaaa",
    "label": "cloud-nat-options-all-b",
    "routing_mode": "GLOBAL",
    "cloud_nat": {
      "subnetworks_to_nat": "ALL_PRIMARY_SUBNETWORKS_ALL_SECONDARY_SUBNETWORKS",
      "log_config": "ALL",
      "min_ports_per_vm": 128,
      "udp_idle_timeout": 100,
      "endpoint_independent_mapping": "ENABLED"
    },
    "subnetworks": [
      {
        "region": "US-WEST1",
        "ip_cidr_range": "172.16.32.0/24"
      },
      {
        "region": "US-WEST1",
        "ip_cidr_range": "172.16.33.0/24"
      },
      {
        "region": "US-EAST4",
        "ip_cidr_range": "172.16.34.0/24"
      }
    ]
  },
  {
    "name": "cloud-nat-options-selected-b",
    "project_id": "rteller-demo-hst-e265-aaaa",
    "label": "cloud-nat-options-selected-b",
    "routing_mode": "GLOBAL",
    "cloud_nat": {
      "subnetworks_to_nat": "SELECTED_PRIMARY_SUBNETWORKS_SELECTED_SECONDARY_SUBNETWORKS",
      "nat_groups": [
        {
          "nat_group_id": "alpha",
          "log_config": "ALL",
          "endpoint_independent_mapping": "DISABLED"
        },
        {
          "nat_group_id": "bravo",
          "log_config": "ERRORS_ONLY",
          "endpoint_independent_mapping": "ENABLED"
        },
        {
          "nat_group_id": "charlie",
          "log_config": "TRANSLATIONS_ONLY"
        },
        {
          "nat_group_id": "delta",
          "log_config": "DISABLED"
        }
      ]
    },
    "subnetworks": [
      {
        "region": "US-WEST1",
        "ip_cidr_range": "172.16.32.0/24",
        "cloud_nat": {
          "nat_group_id": "alpha",
          "subnetworks_to_nat": "PRIMARY_SUBNETWORK"
        }
      },
      {
        "region": "US-WEST1",
        "ip_cidr_range": "172.16.33.0/24",
        "cloud_nat": {
          "nat_group_id": "bravo",
          "subnetworks_to_nat": "PRIMARY_SUBNETWORK"
        }
      },
      {
        "region": "US-EAST4",
        "ip_cidr_range": "172.16.34.0/24",
        "cloud_nat": {
          "nat_group_id": "charlie",
          "subnetworks_to_nat": "PRIMARY_SUBNETWORK_SELECTED_SECONDARY_SUBNETWORKS"
        },
        "secondary_subnetworks": [
          {
            "ip_cidr_range": "172.16.35.0/24",
            "nat_group_id": "delta"
          }
        ]
      }
    ]
  }
]