[
  {
    "name": "cloud-nat-primary",
    "label": "cloud-nat-primary",
    "routing_mode": "GLOBAL",
    "cloud_nat": {
      "subnetworks_to_nat": "ALL_PRIMARY_SUBNETWORKS"
    },
    "subnetworks": [
      {
        "region": "US-WEST1",
        "ip_cidr_range": "172.16.32.0/24"
      },
      {
        "region": "US-CENTRAL1",
        "ip_cidr_range": "172.16.64.0/24"
      }
    ]
  }
]
