[
  {
    "name": "cloud-nat-selected-mix-a",
    "label": "cloud-nat-selected-mix-a",
    "routing_mode": "GLOBAL",
    "cloud_nat": {
      "subnetworks_to_nat": "SELECTED_PRIMARY_SUBNETWORKS_SELECTED_SECONDARY_SUBNETWORKS",
      "nat_groups": [
        {
          "nat_group_id": "asdfasdf"
        },
        {
          "nat_group_id": "aaaa"
        }
      ]
    },
    "subnetworks": [
      {
        "region": "US-WEST1",
        "ip_cidr_range": "172.16.34.0/24",
        "cloud_nat": {
          "nat_group_id": "aaaa",
          "subnetworks_to_nat": "PRIMARY_SUBNETWORK_SELECTED_SECONDARY_SUBNETWORKS"
        },
        "secondary_subnetworks": [
          {
            "ip_cidr_range": "10.34.31.0/24"
          },
          {
            "ip_cidr_range": "10.34.32.0/24"
          }
        ]
      },
      {
        "region": "US-WEST1",
        "ip_cidr_range": "172.16.35.0/24",
        "cloud_nat": {
          "nat_group_id": "aaaa",
          "subnetworks_to_nat": "PRIMARY_SUBNETWORK_SELECTED_SECONDARY_SUBNETWORKS"
        },
        "secondary_subnetworks": [
          {
            "ip_cidr_range": "10.35.30.0/24"
          },
          {
            "nat_group_id": "aaaa",
            "ip_cidr_range": "10.35.31.0/24"
          },
          {
            "nat_group_id": "aaab",
            "ip_cidr_range": "10.35.32.0/24"
          }
        ]
      },
      {
        "region": "US-EAST4",
        "ip_cidr_range": "172.16.64.0/24",
        "cloud_nat": {
          "subnetworks_to_nat": "SELECTED_SECONDARY_SUBNETWORKS"
        }
      },
      {
        "region": "US-WEST1",
        "ip_cidr_range": "172.16.36.0/24",
        "cloud_nat": {
          "nat_group_id": "aaaa",
          "subnetworks_to_nat": "SELECTED_SECONDARY_SUBNETWORKS"
        },
        "secondary_subnetworks": [
          {
            "ip_cidr_range": "10.36.31.0/24"
          },
          {
            "nat_group_id": "asdfasdf",
            "ip_cidr_range": "10.36.32.0/24"
          },
          {
            "nat_group_id": "aaaa",
            "ip_cidr_range": "10.36.33.0/24"
          }
        ]
      }
    ]
  },
  {
    "name": "cloud-nat-selected-mix-b",
    "project_id": "rteller-demo-hst-e265-aaaa",
    "label": "cloud-nat-selected-mix-b",
    "routing_mode": "GLOBAL",
    "cloud_nat": {
      "subnetworks_to_nat": "SELECTED_PRIMARY_SUBNETWORKS_SELECTED_SECONDARY_SUBNETWORKS",
      "nat_groups": [
        {
          "nat_group_id": "asdfasdf"
        },
        {
          "nat_group_id": "aaaa"
        }
      ]
    },
    "subnetworks": [
      {
        "region": "US-WEST1",
        "ip_cidr_range": "172.16.34.0/24",
        "cloud_nat": {
          "nat_group_id": "aaaa",
          "subnetworks_to_nat": "PRIMARY_SUBNETWORK_SELECTED_SECONDARY_SUBNETWORKS"
        },
        "secondary_subnetworks": [
          {
            "ip_cidr_range": "10.34.31.0/24"
          },
          {
            "ip_cidr_range": "10.34.32.0/24"
          }
        ]
      },
      {
        "region": "US-WEST1",
        "ip_cidr_range": "172.16.35.0/24",
        "cloud_nat": {
          "nat_group_id": "aaaa",
          "subnetworks_to_nat": "PRIMARY_SUBNETWORK_SELECTED_SECONDARY_SUBNETWORKS"
        },
        "secondary_subnetworks": [
          {
            "ip_cidr_range": "10.35.30.0/24"
          },
          {
            "nat_group_id": "aaaa",
            "ip_cidr_range": "10.35.31.0/24"
          },
          {
            "nat_group_id": "aaab",
            "ip_cidr_range": "10.35.32.0/24"
          }
        ]
      },
      {
        "region": "US-EAST4",
        "ip_cidr_range": "172.16.64.0/24",
        "cloud_nat": {
          "subnetworks_to_nat": "SELECTED_SECONDARY_SUBNETWORKS"
        }
      },
      {
        "region": "US-WEST1",
        "ip_cidr_range": "172.16.36.0/24",
        "cloud_nat": {
          "nat_group_id": "aaaa",
          "subnetworks_to_nat": "SELECTED_SECONDARY_SUBNETWORKS"
        },
        "secondary_subnetworks": [
          {
            "ip_cidr_range": "10.36.31.0/24"
          },
          {
            "nat_group_id": "asdfasdf",
            "ip_cidr_range": "10.36.32.0/24"
          },
          {
            "nat_group_id": "aaaa",
            "ip_cidr_range": "10.36.33.0/24"
          }
        ]
      }
    ]
  }
]