[
    {
        "label": "routes-advanced-a",
        "project_id": "rteller-demo-svc-e265-aaaa",
        "subnetworks": [
            {
                "region": "US-CENTRAL1",
                "ip_cidr_range": "192.168.0.0/24"
            }
        ],
        "routes": [
            {
                "destination": "1.1.1.1/32",
                "priority": 100,
                "next_hop_address": "192.168.0.253",
                "next_hop_type": "ADDRESS"
            },
            {
                "destination": "1.1.1.1/32",
                "next_hop_address": "192.168.0.252",
                "next_hop_type": "ADDRESS"
            },
            {
                "tags": [
                    "internet-access"
                ],
                "destination": "0.0.0.0/0",
                "priority": 0,
                "next_hop_type": "INTERNET_GATEWAY"
            }
        ]
    },
    {
        "label": "routes-advanced-b",
        "project_id": "rteller-demo-svc-e265-aaab",
        "subnetworks": [
            {
                "region": "US-CENTRAL1",
                "ip_cidr_range": "192.168.0.0/24"
            }
        ],
        "routes": [
            {
                "destination": "1.1.1.1/32",
                "priority": 100,
                "next_hop_address": "192.168.0.253",
                "next_hop_type": "ADDRESS"
            },
            {
                "destination": "1.1.1.1/32",
                "next_hop_address": "192.168.0.252",
                "next_hop_type": "ADDRESS"
            },
            {
                "tags": [
                    "internet-access"
                ],
                "destination": "0.0.0.0/0",
                "priority": 0,
                "next_hop_type": "INTERNET_GATEWAY"
            }
        ]
    }
]