[
    {
        "label": "routes-nh-igw-a",
        "project_id": "rteller-demo-svc-e265-aaaa",
        "subnetworks": [
            {
                "region": "US-CENTRAL1",
                "ip_cidr_range": "192.168.0.0/24"
            }
        ],
        "routes": [
            {
                "tags": ["allow-internet"],
                "destination": "0.0.0.0/0",
                "priority": 0,
                "next_hop_type": "INTERNET_GATEWAY"
            }
        ]
    },
    {
        "label": "routes-nh-igw-b",
        "project_id": "rteller-demo-svc-e265-aaab",
        "subnetworks": [
            {
                "region": "US-CENTRAL1",
                "ip_cidr_range": "192.168.0.0/24"
            }
        ],
        "routes": [
            {
                "tags": ["allow-internet"],
                "destination": "0.0.0.0/0",
                "priority": 0,
                "next_hop_type": "INTERNET_GATEWAY"
            }
        ]
    }
]